# INVDLTEXT00001;Description;Tablename;Fieldname (WAMAS);Shortname (xml relevant);Datatype (WAMAS);Length (WAMAS);Decimalplaces (WAMAS);Mandatory;Foreignkey;Documentation;ERP relevant;Fieldname (SAP);Datatype (SAP);Length (SAP);Decimalplaces (SAP)
1;Inventory demand number;InventoryDemandLine;InventoryDemand.invNo;invNo;S;20;0;X;X;Is part of the unique identification of the InventoryDemand.;
2;System partner line;InventoryDemandLine;sysPartnerLine;sysPartnerLine;N;10;0;X;;This class contains the length of the INV line.;
3;Client;TextLine;TextType.client.clientId;textLineTypeClientId;S;10;0;X;X;Is the unique identification of a client.;
4;Text type;TextLine;TextType.textTypeId;textLineTypeId;S;10;0;X;X; Is a part of the unique identification of a text type. ;
5;Language;TextLine;Language;langId;S;6;0;X;;;
6;Sequence;TextLine;sequence;sequence;N;7;0;X;;A long value used for attributes, which specify a sequence used for ordering or sorting (see guideline "Rules and Recommendations for the Data Model"). Is not related with an Oracle sequence, which is represented by the IDENTIFIER model element.;
7;Text;TextLine;text;textLineText;S;256;0;X;;The text that text template or multi language text of text types for various processes holds.;
8;Data state;;;recordState;E;6;0;;;;com.wamas.wms.core.di.recordtypes.RecordState
